{
  "query_id": "11111111-1111-4111-8111-111111111111",
  "status": "degraded",
  "knowledge_release_id": "22222222-2222-4222-8222-222222222222",
  "answer_blocks": [],
  "checkpoints": [],
  "cases": [],
  "citations": [
    {
      "citation_id": "cite-demo",
      "knowledge_revision_id": "11111111-1111-4111-8111-111111111111",
      "evidence_id": "22222222-2222-4222-8222-222222222222",
      "source_title": "模拟报告",
      "locator": {
        "page": 1
      },
      "review_status": "approved"
    }
  ],
  "missing_conditions": [],
  "warnings": [
    {
      "code": "generation_failed",
      "path": "",
      "message": "模型不可用，仅返回证据"
    }
  ]
}
