{
  "query_id": "11111111-1111-4111-8111-111111111111",
  "status": "answered",
  "knowledge_release_id": "22222222-2222-4222-8222-222222222222",
  "answer_blocks": [
    {
      "text": "此为合同演示案例，不构成工程指导。",
      "citation_ids": [
        "cite-demo"
      ]
    }
  ],
  "checkpoints": [],
  "cases": [],
  "citations": [
    {
      "citation_id": "cite-demo",
      "knowledge_revision_id": "11111111-1111-4111-8111-111111111111",
      "evidence_id": "22222222-2222-4222-8222-222222222222",
      "source_title": "模拟报告",
      "locator": {
        "page": 1
      },
      "review_status": "approved"
    }
  ],
  "missing_conditions": [],
  "warnings": []
}
